id,jounral_abbreviation,article_title,journal_title,article_language,article_jcreated_at,journal_issn,article_jvolumn,article_pagination,article_jissue,author_list
960371,empty,Follow-up care of patients treated for breast cancer: a structured review,Cancer Treatment Reviews,English,1/4/01,empty,30,19-35,1,"{""Hilary L. Bekker"",""David J. Dodwell"",""Rosalind F. Collins""}"
944668,Journal of pain research,"Postamputation pain: epidemiology, mechanisms, and treatment",J Pain Res,eng,1/13/01,1178-7090,6,121-36,0,"{""E. Hsu"",""S. P. Cohen""}"
873987,Journal of clinical microbiology,"Bullous impetigo in children infected with methicillin-resistant Staphylococcus aureus alone or in combination with methicillin-susceptible S. aureus: analysis of genetic characteristics, including assessment of exfoliative toxin gene carriage",J Clin Microbiol,eng,1/11/01,0095-1137 (Print) 0095-1137,49,Apr-72,5,"{""T. Yamamoto"",""T. Takano"",""M. Takano"",""W. Higuchi"",""Y. Nitahara"",""K. Saito"",""D. Shi"",""K. Ozaki""}"
968211,empty,Ebus-tbna yields multiple gene analyses and a panel of immunohistochemical stains on routinely prepared cell blocks in non-small cell lung cancer cases,Laboratory Investigation,English,1/15/01,0023-6837,95,100A,0,"{""Z. Maleki"",""O. Nikolskaia""}"
299635,empty,The Social Workers Guide to Child and Adolescent Mental Health.,Child & Family Social Work,empty,1/11/05,1356-7500,16,241-242,2,"{""Jo Finch""}"
846319,empty,Impact of endoscopic ultrasonography (EUS) on surgical decision-making in upper gastrointestinal tract cancer: An international multicenter study,Surg. Endosc. Interv. Tech.,empty,empty,-5514,21,431-438,3,"{""Nielsen H.O."",""Edwin B."",""H_nerbein M."",""Hovendal C."",""Liedman B."",""Mortensen M.B.""}"
263027,empty,Family care giving in the context of HIV/AIDS in Africa,empty,empty,1/13/01,empty,21,13-21,1,"{""J. Hunt"",""R. A. Powell""}"
788168,Health education & behavior : the official publication of the Society for Public Health Education,Empowered diabetes management: life coaching and pharmacist counseling for employed adults with diabetes,Health Educ Behav,eng,1/13/01,1090-1981,40,581-91,5,"{""D. L. Uehara"",""C. Nishita"",""T. Tom"",""G. Cardazone""}"
146560,J Am Acad Child Adolesc Psychiatry,"School, neighborhood, and family factors are associated with children's bullying involvement: a nationally representative longitudinal study.",Journal of the American Academy of Child and Adolescent Psychiatry,eng,1/9/05,1527-5418,48,545-53,5,"{""Lucy Bowes"",""Barbara Maughan"",""Avshalom Caspi"",""Louise Arseneault"",""Alan Taylor"",""Terrie E Moffitt""}"
498344,Science,"Infectious diseases. As Ebola wanes, trials jockey for patients.","Science (New York, N.Y.)",eng,3/15/04,1095-9203,348,20,6230,"{""Kai Kupferschmidt""}"
385772,Case Rep.Med.,DiGeorge Syndrome Presenting as Hypocalcaemia-Induced Seizures in Adulthood.,Case Reports in Medicine,eng,1/13/01,1687-9627,2013,923129,-1,"{""Alexander Attard"",""Josephine Psaila"",""Adrian Zammit"",""Deborah Grech Marguerat""}"
917417,Korean J.Anesth.,In vivo effects of different anesthetic agents on apoptosis.,Korean Journal of Anesthesiology,eng,1/12/07,2005-7563,63,18-24,1,"{""Hanan F Khafagy"",""Mona M Hassan"",""Emad S Osman"",""Faten M El-Shanawany"",""Abdel Rahman M Fathallah"",""Yasser M Samhan"",""Gehan G El-Fandy""}"
517503,Phys Med Biol,The impact of 3D volume of interest definition on accuracy and precision of activity estimation in quantitative SPECT and planar processing methods.,Physics in medicine and biology,eng,6/21/10,1361-6560,55,3535-44,12,"{""Bin He"",""Eric C Frey""}"
72325,Surgery,Comparison between oral antibiotics and probiotics as bowel preparation for elective colon cancer surgery to prevent infection: prospective randomized trial.,Surgery,eng,1/14/03,1532-7361,155,493-503,3,"{""Yasuhiro Koga"",""Kazutake Okada"",""Toru Ozaki"",""Sotaro Sadahiro"",""Akira Tanaka"",""Toshiyuki Suzuki"",""Hiroko Kamata""}"
516758,IEEE Trans Nucl Sci,Comparison of 3D OS-EM and 4D MAP-RBI-EM reconstruction algorithms for cardiac motion abnormality classification using a motion observer.,IEEE transactions on nuclear science,ENG,8/26/10,0018-9499,57,2571,5,"{""Taek-Soo Lee"",""W Paul Segars"",""Xin He"",""Jing Tang"",""Benjamin M W Tsui""}"
85920,Int. J. Dev. Biol.,"Adipocyte is a non-trivial, dynamic partner of breast cancer cells.",The International journal of developmental biology,eng,1/11/01,1696-3547,55,851-9,7,"{""Marie-Pierre Chenard"",""Nassim Dali-Youcef"",""Emilie Buache"",""Marie-Christine Rio"",""Jinxiang Tan""}"
145874,Scand. Cardiovasc. J.,HRQoL after coronary artery bypass grafting and percutaneous coronary intervention for stable angina.,Scandinavian cardiovascular journal : SCJ,eng,1/9/04,1651-2006,43,Sep-94,2,"{""Michael Luther"",""Kari Korpilahti"",""Matti R Tarkka"",""Heini Huhtala"",""Jari Laurikka"",""Jan-Ola Wistbacka"",""Pertti Loponen""}"
888553,"Rheumatology (Oxford, England)",Weighting improves the information provided by joint counts on the severity of arthritis and its impact on patients' well-being in juvenile idiopathic arthritis,Rheumatology (Oxford),eng,1/6/01,1462-0324,45,343-7,3,"{""A. Ravelli"",""S. Magni-Manzoni"",""A. Pistorio"",""M. Bandeira"",""A. Martini"",""E. Sala"",""A. Falcone"",""A. Buoncompagni"",""N. Ruperto"",""A. Loy""}"
889580,Pain,Chronic pain-associated behaviors in the nursing home: resident versus caregiver perceptions,Pain,empty,1/1/99,0304-3959,80,577-588,3,"{""F. Keefe"",""B. Peterson"",""D. Weiner""}"
732272,EMERG RADIOL,Analysis of responses of radiology personnel to a simulated mass casualty incident after the implementation of an automated alarm system in hospital emergency planning.,Emergency Radiology,empty,1/11/04,1070-3004,18,119-126 8p,2,"{""Linsenmaier U"",""Geyer LL"",""K_rner M"",""Meisel CD"",""Wirth S"",""Reiser MF""}"
351877,AUST NZ J MENT HEALTH NURS,Community nursing issues in Maori mental health.,Australian & New Zealand Journal of Mental Health Nursing,empty,6/1/96,1324-3780,5,54-62,2,"{""A Street"",""C Walsh""}"
276000,Tobacco control,Tobacco-related scenes in television dramas for young Japanese audiences,Tob Control,eng,1/1/99,0964-4563,8,350,3,"{""T. Sone""}"
378289,Physiol Res,Alkaline phosphatase activity of duodenal enterocytes after neonatal administration of monosodium glutamate to rats.,Physiological research / Academia Scientiarum Bohemoslovaca,eng,1/1/00,0862-8408,49,269-77,2,"{""L Lenhardt"",""S Mozes"",""A Martinkov""}"
684476,Physiotherapy,Pulmonary rehabilitation for chronic obstructive pulmonary disease: a pilot study evaluating a once-weekly versus twice-weekly supervised programme.,Physiotherapy,eng,1/10/03,1873-1465,96,68-74,1,"{""Janet Webber"",""Fiona Liddell""}"
467344,empty,Primary Banded Roux-en-Y Gastric Bypass: a Systematic Review.,empty,empty,empty,empty,0,empty,0,{NULL}
39687,empty,Improving referrals to fracture clinic from the paediatric emergency department an intervention.,empty,empty,empty,empty,0,-,0,"{""O. Callender"",""J. Craven"",""C. Martin""}"
697880,empty,"Health literacy and child health promotion: Implications for research, clinical care, and public policy",Pediatrics,empty,empty,empty,124,S306-S314,0,"{""Rudd R."",""Guez G."",""Sanders L.M."",""Baur C."",""Shaw J.S.""}"
179093,empty,Persistence of profenophos and quinolphos on cultivated cucumber and its removal,empty,empty,1/14/01,empty,6,917-920,0,"{""B. Vijayalakshmi"",""D. Siva Rama Prasad"",""D. Raveendranath"",""K. Sri Rama Murthy"",""A. Harinatha Reddy""}"
539034,Eur. Heart J.,Cognitive impairment and risk of cardiovascular events and mortality.,European heart journal,eng,1/12/07,1522-9645,33,1777-86,14,"{""Salim Yusuf"",""Martin O'Donnell"",""Craig Anderson"",""Irene Marzona"",""Peter Sleight"",""Jeff Probstfield"",""Antonio Dans"",""Peggy Gao"",""Jackie Bosch"",""Koon Teo""}"
208435,Knee Surg Sports Traumatol Arthrosc,Comparison of tunnel positions in single-bundle anterior cruciate ligament reconstructions using computer navigation.,"Knee surgery, sports traumatology, arthroscopy : official journal of the ESSKA",eng,1/10/09,1433-7347,18,1282-9,9,"{""Travis G Maak"",""Thomas L Wickiewicz"",""Volker Musahl"",""James E Voos"",""Andrew D Pearle""}"
556624,empty,Fludarabine vs cladribine plus busulfan and low-dose TBI as reduced intensity conditioning for allogeneic hematopoietic stem cell transplantation: a prospective randomized trial,empty,empty,1/7/01,empty,39,193-9,4,"{""D. J. Weisdorf"",""D. Douek"",""Y. Tan"",""L. J. Burns"",""J. S. Miller"",""B. R. Blazar"",""M. Arora"",""T. DeFor"",""M. L. MacMillan"",""M. Markova"",""J. E. Wagner"",""J. N. Barker"",""T. Repka""}"
36253,Horumon To Rinsho,[Limited experience in adrenocortical function tests in infants].,Horumon to rinsho. Clinical endocrinology,jpn,4/1/68,0045-7167,16,273-6,4,"{""Y Hirose"",""S Kurata"",""Y Abe""}"
422857,empty,Does this patient have obstructive sleep apnea?: The Rational Clinical Examination systematic review.,JAMA,eng,1/13/08,empty,310,731-741,7,"{""David L Simel"",""Kathryn A Myers"",""Marko Mrkobrada""}"
720372,empty,APPLICATION OF AGING MANAGEMENT STRATEGIES FOR REACTOR VESSEL INTERNALS AND CORE SUPPORT STRUCTURES,"Proceedings of the Asme Pressure Vessels and Piping Conference 2010, Vol 7",empty,1/10/01,978-0-7918-4926-2,0,277-286,0,"{""H. Q. Xu"",""M. Snyder"",""S. Fyfitch"",""A. Cheta"",""G. Bezdikian"",""V. N. Shah"",""T. R. Liszkai"",""H. Charkas"",""N. Gupta"",""Y. Shoji"",""C. S. Bajwa"",""C. May"",""M. Sanwarwala"",""M. Brumovsky"",""I. Ezekoye""}"
863342,empty,Molecular detection of hepatitis B virus: Recent developments,LaboratoriumsMedizin,empty,1/5/01,empty,29,33-43,1,"{""B. Weber"",""A. Berger""}"
260745,empty,Droperidol vs metoclopramide for prophylaxis of postoperative nausea and vomiting after breast cancer surgery,empty,empty,1/11/01,empty,28,141,0,"{""F. Coletta"",""S. D'Arienzo"",""P. Sansone"",""C. Aurilio"",""M. C. Pace"",""G. Zagaria"",""R. Stumbo""}"
941515,Clin Med,Is prolonged use of computer games a risk factor for deep venous thrombosis in children?,"Clinical medicine (London, England)",empty,1/4/01,1473-4893,4,190-1,2,"{""Richard J. A. Murrin""}"
641972,empty,[Pelvic floor training for women with urinary incontinence].,Forsinket implementering af internationale retningslinjer for computertomografi med iodholdigt kontraststof .,dan,12/7/02,1603-6824,169,593-5,7,"{""Sren Brostrm"",""Gunnar Lose""}"
699523,empty,Regulating free speech,empty,English,1/1/91,empty,23,289-318,2,"{""David Dyzenhaus""}"
946112,empty,Older Women in the Homeless Shelter: Personal Perspectives and Practice Ideas,Journal of Women & Aging,empty,1/11/01,0895-2841,23,360-374,4,"{""Jennifer Davis-Berman""}"
958639,empty,Ethically justified system-level decisions in health care: Toward a decision support workbook for healthcare leaders,Dissertation Abstracts International: Section B: The Sciences and Engineering,empty,1/9/01,-94325,70,238,1,"{""Bashir Jiwani""}"
850418,empty,Takayasu's arteritis with multiple intracranial aneurysms,TAKAYASUSCHE ARTERIITIS MIT MULTIPLEN INTRAKRANIELLEN ANEURYSMEN,empty,empty,0428-8246,23,60-61,1,"{""Matsumoto K."",""Yamada F."",""Fukuda S.""}"
125302,Scand. J. Rheumatol.,Intravenous cyclophosphamide in patients with chronic systemic inflammatory diseases: morbidity and mortality.,Scandinavian journal of rheumatology,eng,1/8/03,0300-9742,37,130-4,2,"{""E A M Janssen"",""C Brodin"",""P Ogreid"",""K Kjellevold"",""L G Gransson"",""L Vatten"",""P R Romundstad"",""R Omdal"",""K Wildhagen""}"
168889,Adm Policy Ment Health,Trends in domestic violence service and leadership: implications for an integrated shelter model,Administration and policy in mental health,empty,1/1/00,0894-587X,27,339-52,5,"{""M. B. Philip"",""R. A. Hayward""}"
63977,Czas Stomatol,[Clinical and histologic results of treatment of serous pulp inflammations with Ledermix].,Czasopismo stomatologiczne,pol,1/1/67,Nov-53,20,1145-53,11,"{""H Zakrzewska-Jastrzebska""}"
782211,empty,Application of a model based on fuzzy logic for evaluating nursing diagnostic accuracy of students,International Journal of Medical Informatics,English,1/13/01,empty,82,875-81,9,"{""R. Jensen"",""F. G. Matos"",""A. da Cruz Dde"",""P. S. Silveira"",""M. H. Lopes"",""N. R. Ortega""}"
473599,empty,The effectiveness of N-acetylcysteine in preventing contrast-induced nephropathy in patients undergoing contrast-enhanced computed tomography: a meta-analysis of randomized controlled trials (Provisional abstract),International Urology and Nephrology,empty,1/13/01,0301-1623,45,1309-1318,5,"{""Yh Hsu"",""Ms Yao"",""Cs Wong"",""Ch Bai"",""My Wu"",""Yf Lin"",""Cy Hsiang"",""Kw Tam"",""Yw Li"",""Hf Hsiang""}"
915463,empty,"[Commentary on] Gait changes in children with cerebral palsy following a neuro-developmental treatment course. Adams M, Chandler L, Shuhmann K, PEDIATRIC PHYSICAL THERAPY, 2000;12:114-120",Pediatric physical therapy,empty,1/2/01,empty,14,55-56 2p,1,"{""J. Slusarski""}"
476199,J Korean Neurosurg Soc,Cognitive Outcome of Pediatric Moyamoya Disease.,Journal of Korean Neurosurgical Society,eng,1/15/06,2005-3711,57,440-4,6,"{""Ju-Seong Kim"",""Dong-Seok Kim"",""Eun-Kyung Park"",""Kyu-Won Shim""}"
405141,empty,Fruit consumption and risk of type 2 diabetes: results from three prospective longitudinal cohort studies.,Bmj-British Medical Journal,eng,1/13/01,1756-1833,347,f5001,-1,"{""Rob M van Dam"",""Frank B Hu"",""Isao Muraki"",""Joann E Manson"",""Fumiaki Imamura"",""Qi Sun"",""Walter C Willett""}"
213794,empty,A biomechanical study of replacement of the posterior cruciate ligament with a graft. Part II: Forces in the graft compared with forces in the intact ligament,empty,empty,1/1/97,empty,79,381-386,3,"{""K.L. Armstrong"",""G.A.M. Finerman"",""K.L. Markolf"",""M.S. Shapiro"",""J.R. Slauterbeck""}"
408902,empty,The safety and immunogenicity of rotavirus vaccination in infants with intestinal failure,J. Pediatric Infect. Dis. Soc.,empty,empty,-14400,3,57-65,1,"{""McNeal M.M."",""Sanchez S.E."",""Jacob S."",""Javid P.J."",""Englund J.A."",""Horslen S.P.""}"
89897,JAMA Otolaryngol Head Neck Surg,A growing lesion on the cheek.,JAMA otolaryngology-- head & neck surgery,eng,1/14/04,2168-619X,140,383-4,4,"{""Eric J Lentsch"",""Jordan Whitney Rawl"",""Michael J Caplan""}"
187552,empty,Protective effect of ginsenoside Rb1 against myocardial ischemia/reperfusion injury in streptozotocin-induced diabetic rats,Molecular Biology Reports,empty,1/11/01,0301-4851,38,4327-4335,7,"{""Y. Wu"",""Z. Y. Xia"",""H. M. Liu"",""S. Q. Lei"",""L. Zhang"",""J. J. Xu"",""B. Zhao"",""J. Dou""}"
144339,J Aerosol Med Pulm Drug Deliv,Comparative in vitro performance of three small-volume valved holding chambers with beclomethasone/formoterol pressurized metered dose inhaler.,Journal of aerosol medicine and pulmonary drug delivery,eng,1/13/08,1941-2703,26,223-7,4,"{""Kamel Alhanout"",""Jean-Christophe Dubus"",""Talita Mota Goncalves"",""Veronique Andrieu"",""Alain Nicolay"",""Davi Pereira de Santana""}"
656518,empty,The effectiveness of anti-illicit-drug public-service announcements: a systematic review and meta-analysis.,Journal of epidemiology and community health.,eng,1/11/10,1470-2738,65,834-40,10,"{""Julio S G Montaner"",""Kora Debeck"",""Evan Wood"",""Thomas Kerr"",""Edward J Mills"",""Dan Werb""}"
925315,Chung Hua I Hsueh Tsa Chih,[Use of statins prior to or following invasive therapy for coronary artery disease].,CHUNG-HUA I HSUEH TSA CHIH [CHINESE MEDICAL JOURNAL],chi,10/26/05,0376-2491,85,15-Jul,40,"{""Wei Gao""}"
130308,Can Forces Dent Serv Q,Malignant lymphomas of the oral region.,Canadian Forces Dental Services quarterly,engfre,1/1/77,0045-4850,18,7-Jan,1,"{""J R Trott"",""D J Morrow"",""D W Buntine""}"
237077,empty,Women's experiences of acupuncture during labour,British Journal of Midwifery,empty,1/13/01,0969-4900,21,254-262,4,"{""Irena Anna Frei"",""Katharina Fierz"",""Angela Poat"",""Martina Gisin""}"
600827,empty,Nutritional supplementation for hip fracture aftercare in the elderly.,Cochrane Database Syst. Rev.,eng,1/1/00,1469-493X,-1,CD001880,4,"{""A Avenell"",""H H Handoll""}"
851773,empty,Quality of life factors and survival after total or extended maxillectomy for sinonasal malignancies.,Journal Of Oral And Maxillofacial Surgery: Official Journal Of The American Association Of Oral And Maxillofacial Surgeons,eng,1/15/04,1531-5053,73,759-63,4,"{""James Murphy"",""Amal Isaiah"",""Joshua E Lubek"",""Jeffrey S Wolf""}"
67292,J. Biol. Chem.,Epithelial Splicing Regulatory Proteins 1 (ESRP1) and 2 (ESRP2) Suppress Cancer Cell Motility via Different Mechanisms.,The Journal of biological chemistry,eng,3/14/10,1083-351X,289,27386-99,40,"{""Mitsuyoshi Motizuki"",""Keiji Miyazawa"",""Tetsuo Kondo"",""Keisuke Masuyama"",""Masao Saitoh"",""Hiroki Ishii"",""Ryohei Katoh"",""Kei Sakamoto"",""Shota Tanaka""}"
129698,Chin. Med. J.,Combined and sequential treatment of oral and maxillofacial malignancies: an evolving concept and clinical protocol.,Chinese medical journal,eng,5/8/10,0366-6999,121,1945-52,19,"{""Zhi-yuan Zhang"",""Wei-liu Qiu"",""Jia-wei Zheng""}"
254327,empty,Evaluation of a workshop on evidence-based medicine for social insurance physicians.,Occupational Medicine-Oxford,eng,1/8/03,0962-7480,58,Jul-83,2,"{""Jos H Verbeek"",""Rob Kok"",""Jan L Hoving"",""Frederieke G Schaafsma"",""Frank J H van Dijk"",""Paul B A Smits""}"
556803,empty,Neurocognitive assessment in 13 patients affected by muchopolysaccharidosis IVA (MPS IVA),empty,empty,1/14/01,empty,37,S136,1,"{""M. Rigoldi"",""S. Gasperini"",""B. M. Del Menico"",""F. Nichelli"",""A. Boncimino"",""M. Calabria"",""P. Meregalli"",""R. Parini""}"
73792,Environ. Toxicol. Pharmacol.,Evaluation of the protective effect of Ilex paraguariensis and Camellia sinensis extracts on the prevention of oxidative damage caused by ultraviolet radiation.,Environmental toxicology and pharmacology,eng,1/14/01,1872-7077,37,195-201,1,"{""Marlon Barg"",""Emilio L Streck"",""Lara M Gomes"",""Vanessa M Andrade"",""Daniela D Leffa"",""Felipe Dal-Pizzol"",""Fabricia Petronilho"",""Francieli Vuolo"",""Milena Carvalho-Silva"",""Fernanda Balbinot"",""Gislaine T Rezin""}"
484593,empty,New anticoagulants for atrial fibrillation.,J. Cardiovasc. Med.,eng,1/9/06,1558-2027,10,446-53,6,"{""Raffaele De Caterina"",""Giulia Renda"",""Steen Dalby Kristensen""}"
351700,empty,Our Health Counts -- Unmasking Health and Social Disparities among Urban Aboriginal People in Ontario.,"Dissertation Abstracts International, A: The Humanities and Social Sciences",English,empty,empty,0,empty,0,"{""Michelle Firestone""}"
105981,Science,A common variant in the FTO gene is associated with body mass index and predisposes to childhood and adult obesity.,"Science (New York, N.Y.)",eng,11/7/05,1095-9203,316,889-94,5826,"{""George Davey Smith"",""Amanda J Bennett"",""Eleftheria Zeggini"",""Marjo-Riitta Jarvelin"",""Nicholas J Wareham"",""Lorna W Harries"",""Colin N A Palmer"",""Shah Ebrahim"",""Timothy M Frayling"",""Susan M Ring"",""Bridget Knight"",""Sian Ellard"",""Katharine R Owen"",""Rachel M Freathy"",""Hana Lango"",""Debbie A Lawlor"",""Lon R Cardon"",""John R B Perry"",""Jeffrey C Barrett"",""Andrew D Morris"",""Graham A Hitman"",""Katherine S Elliott"",""Ulla Sovio"",""Mark I McCarthy"",""David Melzer"",""Alex S F Doney"",""Andrew R Ness"",""Yoav Ben-Shlomo"",""Andrew T Hattersley"",""Ann-Marie Patch"",""Nicholas J Timpson"",""Nigel W Rayner"",""Mark Walker"",""Michael N Weedon"",""Ruth J F Loos"",""Fredrik Karpe"",""In_s Barroso"",""Luigi Ferrucci"",""Christopher J Groves"",""Cecilia M Lindgren"",""Beverley Shields""}"
408198,Neuroscience,"The parvalbumin-positive interneurons in the mouse dentate gyrus express GABAA receptor subunits 1, _2, and  along their extrasynaptic cell membrane.",Neuroscience,eng,12/19/13,1873-7544,254,80-96,-1,"{""H H_ger"",""W Sieghart"",""T Klausberger"",""I Milenkovic"",""M Vasiljevic"",""D Maurer""}"
30272,Exp. Neurol.,Glial cells in amyotrophic lateral sclerosis.,Experimental neurology,ENG,5/22/14,1090-2430,-1,empty,-1,"{""T Philips"",""J D Rothstein""}"
623367,empty,Diagnosing acute cardiac ischemia in the emergency department: a systematic review of the accuracy and clinical effect of current technologies.,Annals of Emergency Medicine American College of Emergency Physician's Research Forum,eng,1/1/05,0196-0644,37,453-60,5,"{""J P Ioannidis"",""J Lau"",""C Milch"",""D Salem"",""P W Chew"",""N Terrin"",""E M Balk""}"
13408,Paediatr Child Health,Eczema - quiz.,Paediatrics & child health,eng,3/1/00,1918-1485,5,105,2,{NULL}
449003,empty,"Stroke in children with posterior fossa brain malformations, hemangiomas, arterial anomalies, coarctation of the aorta and cardiac defects, and eye abnormalities (PHACE) syndrome: A systematic review of the literature.",empty,empty,empty,empty,0,empty,0,{NULL}
299297,empty,"Employing a youth-led adult-guided framework: ""why drive high?"" social marketing campaign.",Family & Community Health,empty,1/11/10,0160-6379,34,319-330,4,"{""Terry-Lynne Marko"",""Tyler Watt""}"
302268,empty,Review of Handbook for Working with Children and Youth: Pathways to Resilience across Cultures and Contexts,empty,English,1/6/01,empty,47,230-232,3,"{""Robert J. Flynn""}"
592663,empty,Helicobacter pylori antibiotic resistance patterns and genotypes in adult dyspeptic patients from a regional population in North Wales,empty,eng,1/4/01,empty,54,435-40,2,"{""A. M. Walker"",""J. Xerry"",""K. Davies"",""N. C. Elviss"",""R. J. Owen""}"
520843,AJR Am J Roentgenol,Sonographically guided biopsy of focal lesions: a comparison of freehand and probe-guided techniques using a phantom.,AJR. American Journal Of Roentgenology,eng,1/5/05,0361-803X,184,1652-6,5,"{""Duncan M Brooks"",""Pramit M Phal"",""Rory Wolfe""}"
460786,empty,Splinting osseointegrated implants and natural teeth in partially edentulous patients: a systematic review of the literature. [Review],empty,empty,empty,empty,0,empty,0,{NULL}
866131,empty,Long-term subcutaneous recombinant interleukin-2 as maintenance therapy: Biological effects and clinical implications,Cancer Biotherapy,empty,1/1/95,1062-8401,10,195-203,3,"{""V. Lorusso"",""M. De Lena"",""M. Guida"",""M. Correale"",""I. Abbate"",""A. Latorre"",""A. Casamassima"",""M. D. Musci""}"
751811,empty,School soft drink intervention study,BMJ,empty,1/4/01,1468-5833 (Electronic),329,E315-6,7462,"{""S. A. French"",""M. Story"",""P. J. Hannan""}"
436781,empty,Hoarse voice in adults: An evidence-based approach to the 12 minute consultation.,empty,empty,empty,empty,0,empty,0,{NULL}
796900,"Rheumatology (Oxford, England)","Chronic compartment syndrome, an important cause of work-related upper limb disorder",Rheumatology (Oxford),empty,1/5/01,1462-0324,44,1442-6,11,"{""J. P. Heath"",""R. L. Williams"",""M. H. Pritchard""}"
491837,empty,"Sleep, sleep-dependent procedural learning and vigilance in chronic cocaine users: Evidence for occult insomnia",empty,English,1/6/01,empty,82,238-49,3,"{""R. T. Malison"",""E. F. Pace-Schott"",""V. Coric"",""P. T. Morgan"",""R. Stickgold"",""Z. H. Sahul""}"
893227,empty,A screening methodology for crowdsourcing video QoE evaluation,empty,empty,1/14/01,empty,0,empty,0,"{""E. Anegekuh, L., Sun, L., Ifeachor""}"
525874,empty,Potential for inter-observer and intra-observer variability in x-ray review to establish stone-free rates after lithotripsy.,J. Urol.,eng,3/1/92,0022-5347,147,559-62,3,"{""D Caron"",""S J Witchell"",""M A Jewett"",""E L St Louis"",""R R Gray"",""C Bombardier"",""S Kumra"",""K E Psihramis"",""M R Ryan""}"
26475,Disabil Rehabil,Situating universal design architecture: designing with whom?,Disability and rehabilitation,ENG,7/28/14,1464-5165,-1,6-Jan,-1,"{""Paul Jones""}"
476191,J Stroke Cerebrovasc Dis,Endovascular Treatment of Ruptured Large or Wide-Neck Basilar Tip Aneurysms Associated with Moyamoya Disease Using the Stent-Assisted Coil Technique.,Journal of stroke and cerebrovascular diseases : the official journal of National Stroke Association,ENG,7/24/15,1532-8511,-1,empty,-1,"{""Yibin Fang"",""Pengfei Yang"",""Jianmin Liu"",""Yi Xu"",""Qinghai Huang"",""Wenyuan Zhao"",""Dongwei Dai"",""Yan Chen""}"
719389,empty,Subjective states: A more robust model,Games and Economic Behavior,empty,1/9/01,0899-8256,67,408-427,2,"{""K. Seo"",""L. G. Epstein""}"
467318,empty,The fundamental role of bone morphogenetic protein 15 in ovarian function and its      involvement in female fertility disorders.,empty,empty,empty,empty,0,empty,0,{NULL}
268361,The Journal of bone and joint surgery. British volume,Giant-cell tumour of the knee: the condition of the cartilage after treatment by curettage and cementing,J Bone Joint Surg Br,eng,1/7/01,0301-620X (Print) 0301-620x,89,361-5,3,"{""K. Jonsson"",""A. Rydholm"",""I. Kristiansson"",""D. Heinegard"",""F. V. von Steyern"",""P. Mannfolk""}"
664795,J. Cancer Res. Clin. Oncol.,Diagnostic accuracy of endoscopic ultrasound-guided fine-needle aspiration for solid pancreatic lesion: a systematic review.,Journal of cancer research and clinical oncology,eng,1/12/09,1432-1335,138,1433-41,9,"{""Hangcheng Zhou"",""Renbao Yang"",""Jiong Chen"",""Yunlian Xia"",""Yin Lu""}"
102180,Int J Obes (Lond),"Safety, tolerability and sustained weight loss over 2 years with the once-daily human GLP-1 analog, liraglutide.",International journal of obesity (2005),eng,1/12/06,1476-5497,36,843-54,6,"{""R Carraro"",""M F Rasmussen"",""L Niskanen"",""A Harper"",""N Finer"",""S R_ssner"",""M Kunesova"",""L Van Gaal"",""M E J Lean"",""A Astrup"",""A Rissanen"",""M J Savolainen"",""[Collective Name] NN8022-1807 Investigators""}"
258486,empty,Web-based nutrition education intervention improves self-efficacy and self-regulation related to increased dairy intake in college students,empty,English,1/10/01,empty,110,1723-7,11,"{""Kathy W Hosig"",""Sharon M Nickols-Richardson"",""Kavita H Poddar"",""Susan E Duncan"",""Eileen S Anderson""}"
