id,jounral_abbreviation,article_title,journal_title,article_language,article_jcreated_at,journal_issn,article_jvolumn,article_pagination,article_jissue,author_list
617801,empty,Remission rates following antidepressant therapy with bupropion or selective serotonin reuptake inhibitors: a meta-analysis of original data from 7 randomized controlled trials.,J. Clin. Psychiatry,eng,1/5/08,0160-6689,66,974-81,8,"{""Michael E Thase"",""Younghua Wang"",""April E Harriett"",""Melinda Mitton"",""Carol B Rockett"",""Barbara R Haight"",""Jack G Modell"",""Nathalie Richard"",""Susan VanMeter""}"
480030,empty,Adaptive convex combination approach for the identification of improper quaternion processes,empty,eng,1/14/01,empty,25,172-82,1,"{""C. Jahanchahi"",""C. C. Took"",""B. C. Ujang"",""D. P. Mandic""}"
660499,empty,Inappropriate use of emergency services: a systematic review of prevalence and associated factors.,"Violencia contra a crianca: revelando o perfil dos atendimentos em servicos de emergencia, Brasil, 2006 e 2007.",eng,1/9/01,1678-4464,25,28-Jul,1,"{""Marlos Rodrigues Domingues"",""Ana Claudia Gastal Fassa"",""Maria Laura Vidal Carret""}"
355078,empty,Use of episiotomy in the United States,Birth,eng,1/2/01,1523-536X,29,Jun-74,1,"{""M. C. Klein""}"
696985,J Addict Dis,"The Diversion of Ultram, Ultracet, and generic tramadol HCL.",Journal of addictive diseases,eng,1/6/01,1545-0848,25,53-58,2,"{""George E. Woody"",""Anne Geller"",""Edgar H. Adams"",""Theodore J. Cicero"",""Alvaro Munoz"",""Edward C. Senay"",""James A. Inciardi""}"
826471,Psychosom Med,Aberrances in autonomic cardiovascular regulation in fibromyalgia syndrome and their relevance for clinical pain reports,Psychosomatic medicine,eng,1/10/01,0033-3174,72,462-70,5,"{""Sergio Garrido"",""Angeles Pulgar"",""Stefan Duschek"",""Mar_a Mart_n-Vzquez"",""Gustavo A Reyes Del Paso""}"
807737,empty,Sorafenib and pegylated interferon-alpha-2b in advanced metastatic melanoma: A multicenter phase II DeCOG trial,J. Clin. Oncol.,empty,empty,0732-183X,28,empty,15,"{""Ugurel S."",""Schadendorf D."",""Garbe C."",""Trefzer U."",""Egberts F."",""Hassel J."",""Weichenthal M."",""Hauschild A."",""Mauch C."",""Gutzmer R.""}"
875781,The Journal of hospital infection,Dispersal of methicillin-resistant Staphylococcus epidermidis by staff in an operating suite for thoracic and cardiovascular surgery: relation to skin carriage and clothing,J Hosp Infect,eng,1/1/00,0195-6701 (Print) 0195-6701,44,119-26,2,"{""P. Domicel"",""A. Tammelin"",""E. Stahle"",""A. Hambraeus""}"
322953,empty,Psychometric validation of the Growth and Empowerment Measure (GEM) applied with Indigenous Australians,Australian and New Zealand Journal of Psychiatry,empty,1/10/01,Apr-74,44,791-799,9,"{""Komla Tsey"",""Melissa R Haswell"",""Lyndon Reilly"",""David Kavanagh"",""Chris Doran"",""Arlene Laliberte"",""Andrew Wilson"",""Yvonne Cadet-James""}"
123731,empty,Alveolar soft part sarcoma of the uterine corpus. Report of two cases and review of the literature,empty,eng,1/1/98,empty,194,59-63,1,"{""K. Radig"",""A. Roessner"",""P. Buhtz""}"
180588,empty,It's Time Practitioners Help Families Clear the Air of Secondhand Smoke: A Commentary on Pyle et al. (2005),empty,empty,1/5/01,empty,23,25-29,0,"{""Geoffrey C. Williams"",""Bai Brownson Difranza Gehrman Glantz Law Mokdad Ory Panagiotakos Pechacek Pyle Sargent Sweda Whincup Whitlock Arcavi""}"
440684,empty,Hemostatic resuscitation for massive bleeding: The paradigm of plasma and platelets - A review of the current literature.,empty,empty,empty,empty,0,empty,0,{NULL}
758629,empty,Studies on the biological activity of two strains of BCG: influence of production conditions.,DEV. BIOL. STAND.,eng,1/1/86,0301-5149,58,105-18,-1,"{""M Chouchkova"",""A Engibarov""}"
964184,Circulation,Myocardial fibrosis by T1 mapping is an early indicator of severe cardiac allograft vasculopathy,Circulation,empty,1/13/01,22-Sep,128,empty,22,"{""N. Harcourt"",""S. C. Masri"",""M. Colvin"",""G. Raveendran""}"
265490,Annals of the rheumatic diseases,Follistatin-like protein 1 regulates chondrocyte proliferation and chondrogenic differentiation of mesenchymal stem cells,Ann Rheum Dis,Eng,1/14/01,Mar-67,0,empty,0,"{""S. M. Smith"",""A. D. Marinov"",""R. Hirsch"",""D. S. Bushnell"",""B. T. Campfield"",""H. C. Blair"",""Y. Chaly""}"
463556,empty,Structural brain changes associated with antipsychotic treatment in schizophrenia      as revealed by voxel-based morphometric MRI: an activation likelihood estimation       meta-analysis.,empty,empty,empty,empty,0,empty,0,{NULL}
749844,Hawai'i journal of medicine & public health : a journal of Asia Pacific Medicine & Public Health,"Insights in public health: taxing sugar sweetened beverages to improve public health: policy action in Hawai'i. Doctoral Health Policy Seminar, Spring 2013",Hawaii J Med Public Health,empty,1/13/01,2165-8242,72,286-91,8,"{""T. Sentell"",""T. Usagawa"",""M. Hagiwara"",""T. Peacock"",""H. Hee Heo"",""M. G. Pearce"",""L. Choy"",""M. R. Dela Cruz""}"
300057,Bundesgesundheitsblatt Gesundheitsforschung Gesundheitsschutz,[Evidence-based therapy guideline of the German Working Group on Obesity in Childhood and Adolescence].,"Bundesgesundheitsblatt, Gesundheitsforschung, Gesundheitsschutz",ger,1/11/05,1437-1588,54,584-90,5,"{""M Wabitsch"",""A Moss"",""D Kunze""}"
166521,empty,The cost of national service frameworks,empty,eng,1/4/01,empty,65,68-9 ST  - The cost of national service frameworks-,0,"{""R. CN  - PubMed DA  - Feb DP  - NLM ET  - 2004/03/05 Boyle""}"
292018,Diabetes Forecast,"Simple steps to fitness. Secrets of strength. Strength training is as important to weight loss and fitness as aerobic exercise is, but many people ignore it. Here's how to get started.",Diabetes forecast,eng,1/2/08,0095-8301,55,98--100,8,"{""Shauna S Roberts""}"
181456,empty,Homeplace and Housing in the Lives of Low-Income Urban African American Families,empty,empty,1/5/01,empty,0,166-188,0,"{""Linda M. Burton"",""Altman Bullard Burton Burton Burton Burton Burton Clark Conley Dilworth-Williams Fischer Foucault Franklin Gieryn Gilbert Goering Hooks Howard Kidder Lahiri Lawson Clark Lawson Clark Lawson Clark Low Massey Oliver Perkins Rosenbaum Rosenbaum Sanders Stack Allan"",""Sherri Lawson Clark""}"
668772,Biomed Rep,"Lack of association between the connexin 37 C1019T gene polymorphism and coronary artery disease in a Chinese population: Meta-analysis of 2,206 subjects.",Biomedical reports,ENG,1/13/05,2049-9434,1,464-468,3,"{""Yan-Yan Li"",""Yun Qian"",""Chuan-Wei Zhou""}"
276001,[Nihon koshu eisei zasshi] Japanese journal of public health,[Effects of tobacco advertising regulations in various countries],Nihon Koshu Eisei Zasshi,jpn,1/1/95,0546-1766 (Print) 0546-1766,42,1017-28,12,"{""T. Sone""}"
788507,American journal of health-system pharmacy : AJHP : official journal of the American Society of Health-System Pharmacists,Intensive glucose control in the management of diabetes mellitus and inpatient hyperglycemia,Am J Health Syst Pharm,eng,1/10/01,1079-2082 (Print) 1079-2082,67,798-805,10,"{""S. B. Levy"",""A. O. Shogbon""}"
620483,Oncol Nurs Forum,The value of breast self-examination: meta-analysis of the research literature.,Oncology nursing forum,eng,1/1/06,0190-535X,28,815-22,5,"{""Y L Ku""}"
433039,empty,Palliative sedation therapy in the last weeks of life: a literature review and recommendations for standards.,empty,empty,empty,empty,0,empty,0,{NULL}
737167,Nursing standard (Royal College of Nursing (Great Britain) : 1987),Understanding depression in palliative and end-of-life care,Nurs Stand,en,empty,0029-6570 (Print) 0029-6570,23,"48-57; quiz 58, 60",12,"{""S. Ashelford"",""V. Taylor""}"
744601,empty,Inhaled anticholinergics and risk for acute urinary retention: A case-crossover and case-time-control study,Value Health,empty,empty,1098-3015,17,A776,7,"{""Dilokthornsakul P."",""Joo M.J."",""Lee T.A."",""Pickard A.S."",""Lin F.J.""}"
856471,empty,Compartmentalization of Fas and Fas ligand may prevent auto- or paracrine apoptosis in epithelial cells,EXPERIMENTAL CELL RESEARCH,eng,1/3/01,empty,284,283-90,2,"{""W. Hunziker"",""K. H. Tan""}"
570704,empty,Rituximab-related viral infections in lymphoma patients.,Leukemia & Lymphoma,eng,1/7/07,1042-8194,48,1307-12,7,"{""Saadettin Kilickap"",""Omer Dizdar"",""Sercan Aksoy"",""Ibrahim Barista"",""Hakan Harputluoglu"",""Kadri Altundag"",""Didem Sener Dede""}"
520153,empty,Fetal lung volume measurements: determination with MR imaging--effect of various factors.,RADIOLOGY,eng,1/6/07,0033-8419,240,187-93,1,"{""Carol E Barnewolt"",""Hiroto Hatabu"",""Mizuki Nishino"",""Deborah Levine"",""Henry A Feldman"",""Judy A Estroff"",""Valerie L Ward""}"
259267,empty,Intra-operative change of gastric ph during laparotomic cholecystectomy under general anaesthesia: A prospective case-control study,empty,empty,1/12/01,empty,56,40-43,0,"{""S. Dey"",""P. Bhattacharyya"",""B. K. Biswas"",""B. Bhattarai"",""P. Bhakta""}"
24381,Headache,The CARE guidelines: consensus-based clinical case reporting guideline development.,Headache,eng,1/13/11,1526-4610,53,1541-7,10,"{""[Collective Name] CARE Group"",""Joel J Gagnier"",""David Moher"",""Douglas G Altman"",""Gunver Kienle"",""David Riley"",""Harold Sox""}"
827921,empty,Effect of a creative-bonding intervention on Taiwanese nursing students' self-transcendence and attitudes toward elders.,Res Nurs Health,eng,1/9/04,1098-240X,32,204-16,2,"{""Sandra M Walsh"",""Shiue Chen""}"
461204,empty,Fc receptor-like 3 (FCRL3) -169 C/T polymorphism and systemic lupus erythematosus: A meta-analysis.,empty,empty,empty,empty,0,empty,0,{NULL}
482860,empty,[Indirect anastomoses for moyamoya disease].,No shinkei geka. Neurological surgery,jpn,9/1/98,0301-2603,26,769-86,9,"{""Y Matsushima""}"
18298,Circ. J.,Ulcer Healing After Peripheral Intervention.,Circulation journal : official journal of the Japanese Circulation Society,ENG,4/14/07,1347-4820,-1,empty,-1,"{""Daiki Uchida"",""Yukihiro Saito"",""Hisashi Uchida"",""Atsuhiro Koya"",""Nobuyoshi Azuma""}"
365654,PloS one,Measuring the bright side of being blue: a new tool for assessing analytical rumination in depression.,PLoS One,eng,1/14/01,1932-6203,9,e112077,11,"{""Skye P Barbic"",""Paul W Andrews"",""Zachary Durisko""}"
625306,empty,[Mammographic density: a valid risk factor for breast cancer?].,Prvention de l'insuffisance rnale induite par les produits de contrnste iodes,fre,1/8/09,0221-0363,89,1140-50,9,"{""G Boutet""}"
572343,empty,High-dose sequential (HDS) chemotherapy for high-risk non-Hodgkin's lymphoma: long-term analysis and future developments.,Ann. Hematol.,eng,1/1/01,0939-5555,80,B123-6,-1,"{""M Ladetto"",""D Caracciolo"",""G Rossi"",""C Marinone"",""L Bergui"",""A Cuttica"",""A Salomone"",""M Boccadoro"",""I Ricca"",""C Tarella"",""M Pagano"",""F Zallio"",""P Gavarotti"",""A Pileri"",""A de Crescenzo""}"
88262,J. Natl. Cancer Inst.,Core symptom measures in cancer clinical trials.,Journal of the National Cancer Institute,eng,1/14/07,1460-2105,106,empty,7,"{""Carolyn Gotay""}"
663339,AIDS,Human papillomavirus infection and increased risk of HIV acquisition. A systematic review and meta-analysis.,"AIDS (London, England)",eng,11/13/12,1473-5571,26,2211-22,17,"{""Chunhui Wang"",""Richard Hayes"",""Louise Kuhn"",""Stephen Shiboski"",""Jennifer S Smith"",""Natasha L Larke"",""Deborah Watson-Jones"",""Catherine F Houlihan"",""Patti E Gravitt"",""Karen K Smith-McCune""}"
718292,Oral Surg. Oral Med. Oral Pathol.,Prevalence of different morphologic forms of the human tongue in young Finns.,"Oral surgery, oral medicine, and oral pathology",eng,2/1/82,0030-4220,53,152-6,2,"{""M Mikkonen"",""R Kotilainen"",""A Kullaa-Mikkonen""}"
245200,Archives of internal medicine,Osteoporosis in men,Arch Intern Med,eng,1/1/98,0003-9926 (Print) 0003-9926,158,194,2,"{""M. Galus""}"
307302,empty,Neurolymphatische Bahnen: neue wissenschaftliche Nachweise untermauern die Perrin-Technik,empty,empty,1/13/06,empty,14,15-Oct,2,"{""Raymond N. Perrin""}"
217418,empty,Long term follow-up of conservative treatment of severely traumatized maxillary incisors,empty,empty,1/1/97,empty,13,190-192,4,"{""Z. Hirschfeld"",""I. Brin"",""A. Fuks"",""M. Guelmann""}"
413717,empty,Magnetic resonance imaging evaluation of bone marrow changes in obstructive sleep apnoea syndrome in adults,empty,English     Italian,1/6/01,empty,111,572-84,4,"{""A. R. Aleandri"",""D. Mancini"",""T. Cosentini"",""R. Le Donne"",""N. Colavita""}"
62246,Oper Dent,Pulpal response to a fluoride-releasing all-in-one resin bonding system.,Operative dentistry,eng,1/2/05,0361-7734,27,271-7,3,"{""Masayuki Otsuki"",""Makoto Arakawa"",""Hidekazu Sonoda"",""Yasutaka Sasafuchi"",""Yuichi Kitasako"",""Junji Tagami""}"
945021,Movement disorders : official journal of the Movement Disorder Society,Improvement of action tremor by chronic cortical stimulation,Mov Disord,eng,1/1/98,0885-3185,13,Aug-84,1,"{""B. Pollin"",""C. Geny"",""J. P. Nguyen"",""P. Cesaro"",""A. Feve""}"
649817,Psychol Assess,Validity of Rorschach Inkblot scores for discriminating psychopaths from non-psychopaths in forensic populations: a meta-analysis.,Psychological assessment,eng,1/10/06,1939-134X,22,336-49,2,"{""Scott O Lilienfeld"",""Keli Holloway Allen"",""Howard N Garb"",""Jessica L Wildermuth"",""M Teresa Nezworski"",""James M Wood""}"
934327,empty,Use of a Brief Phone Call After ED Discharge,empty,empty,empty,empty,0,empty,0,"{""NCT01893931 ""}"
546484,empty,The Effects of Pre-Reading and Sharing Mechanisms on Learning with the Use of Annotations,Turkish Online Journal of Educational Technology - TOJET,empty,1/11/04,1303-6521,10,234-249,2,"{""Wu-Yuin Hwang"",""Guo-Liang Hsu""}"
917231,empty,[Occupational exposure to sevoflurane in pediatric operating rooms: the multi-point sampling method for risk assessment].,Patologie asbesto correlate in congiunti di lavoratori del settore cemento-amianto.,ita,1/12/07,1592-7830,34,266-8,3,"{""V Cerabona"",""M Wachocka"",""U Moscato"",""V Camisa"",""M G Tucci"",""S Zaffina"",""V Montaldi"",""A Poscia""}"
887418,empty,Impact of crizotinib on patient-reported symptoms and global quality of life (QoL) compared with chemotherapy in a phase III study of advanced alk-positive non-small cell lung cancer (NSCLC),European Journal of Cancer,empty,1/13/01,empty,49,-,0,"{""V. Hirsh"",""J.Y. Han"",""F. Blackhall"",""S. Iyer"",""D.W. Kim"",""A. Shaw"",""A. Reisman"",""K. Wilner"",""H. Nokihara"",""B. Besse""}"
724055,empty,A systematic review and meta-analysis of trials of treatment of depression from India,Indian Journal of Psychiatry,English,1/14/01,empty,56,29-38,0,"{""S. Sarkar"",""S. Grover""}"
63738,Stomatologiia (Mosk),[The use of ethonium paste in the treatment of deep dental caries].,Stomatologiia,rus,3/1/71,0039-1735,50,79-80,2,"{""P K Shestakov""}"
422739,BMC Med,Reporting methods in studies developing prognostic models in cancer: a review.,BMC medicine,eng,1/10/01,1741-7015,8,20-20,0,"{""Patrick Royston"",""Rachel Waters"",""Susan Mallett"",""Douglas G Altman"",""Susan Dutton""}"
97795,empty,Hospital discharge after ambulatory knee arthroscopy: a comparison of epidural 2-chloroprocaine versus lidocaine,empty,empty,1/1/01,empty,26,35-40,1,"{""J. M. Neal"",""D. J. Kopacz"",""M. A. Lewis"",""J. J. Deck""}"
155127,Oral Surg Oral Med Oral Pathol Oral Radiol,p16(INK4) Expression is not associated with human papillomavirus in oral lichen planus.,"Oral surgery, oral medicine, oral pathology and oral radiology",eng,1/14/12,2212-4411,118,694-702,6,"{""Lucio Montebugnoli"",""Luca Morandi"",""Luca Scapoli"",""Annalisa Palmieri"",""Davide B Gissi"",""Maria Pia Foschini"",""Ilaria Manelli""}"
100986,J Cardiovasc Med (Hagerstown),"Association of bleeding, mortality and sex in acute coronary syndromes: the missing triangle.","Journal of cardiovascular medicine (Hagerstown, Md.)",ENG,9/23/14,1558-2035,-1,empty,-1,"{""Rossana De Palma"",""Paolo Ortolani"",""Caterina Caminiti"",""Emilia Solinas"",""Piera Angelica Merlini"",""Diego Ardissino"",""Giorgia Paoli"",""Maria Francesca Notarangelo"",""Paolo Guastaroba"",""Antonio Marzocchi"",""Luigi Vignali"",""Roxana Mehran"",""Antonio Manari""}"
166179,empty,"[Severe exposure to environmental lead in a child population in Antofagasta, Chile]","Exposicion severa a plomo ambiental en una poblacion infantil de Antofagasta, Chile.",empty,1/1/00,0034-9887,128,221-32,2,"{""I. Delgado"",""J. Vega""}"
740811,empty,Tracheostomy Care and Complications in the Intensive Care Unit,Critical Care Nurse,empty,1/13/01,empty,33,18-31 14p,5,"{""Linda L. Morris"",""Andrea Whitmer"",""Erik McIntosh""}"
379577,Appl Radiat Isot,"Monitoring of fluid changes in hospitalized, Malnourished, Guatemalan children using bioelectrical impedance spectroscopy (BIS).","Applied radiation and isotopes : including data, instrumentation and methods for use in agriculture, industry and medicine",eng,5/1/98,0969-8043,49,615-7,5,"{""C Pithan"",""M Mazariegos"",""N W Solomons"",""P F_rst""}"
658981,J Clin Epidemiol,Preliminary state of development of prediction models for primary care physical therapy: a systematic review.,Journal of clinical epidemiology,eng,1/12/12,1878-5921,65,1257-66,12,"{""Martijn W Heymans"",""Tobias van den Berg"",""Han J R Anema"",""Lieke van Oort"",""Bart W Koes"",""Arianne P Verhagen"",""Riekie H C W de Vet""}"
215650,empty,Bruxismo em crian_as Bruxism in children,empty,pt,empty,empty,3,Aug-91,2,"{""Ronaldo Fazzi"",""Ana Estela Haddad"",""Maria Salete Nahs Pires Corr_a""}"
521132,The Journal of hand surgery,A cadaver model to evaluate the accuracy and reproducibility of plain radiograph step and gap measurements for intra-articular fracture of the distal radius.,J Hand Surg Am,eng,1/4/09,0363-5023,29,841-7,5,"{""Jeff Knight"",""Jeffery M Smith"",""Thomas E Trumble"",""Wren V McCallister""}"
892609,empty,"13th IEEE/ACM Symposium on Distributed Simulation and Real-Time Applications, DS-RT 2009",empty,empty,empty,empty,0,empty,0,{NULL}
366275,Eur J Prev Cardiol,"A systematic review on the application of cardiovascular risk prediction models in pharmacoeconomics, with a focus on primary prevention.",European journal of preventive cardiology,eng,1/12/08,2047-4881,19,42-53,2,"{""Maarten J Postma"",""Petros Pechlivanoglou"",""Jelena Stevanovic""}"
513630,J. Natl. Cancer Inst.,Pan-Canadian study of mammography screening and mortality from breast cancer.,Journal of the National Cancer Institute,eng,1/14/11,1460-2105,106,empty,11,"{""Jennifer Payne"",""Rukshanda Ahmad"",""Gregory Doyle"",""Norm Phillips"",""Anna M Chiarelli"",""Christine Wilson"",""Kathleen Decker"",""Andrew Coldman"",""Bin Zhang"",""Jacques Brisson""}"
605423,empty,Alcohol-related morbidity and mortality.,Alcohol Research & Health,eng,1/3/01,1535-7414,27,39-51,1,"{""J_rgen Rehm"",""Gerhard Gmel"",""Maurizio Trevisan"",""Christopher T Sempos""}"
495319,empty,Clinical outcome following ICD removal. The Bilitch Registry Group,empty,eng,1/1/93,empty,16,186-192,0,"{""S. Furman"",""D. T. Kawanishi"",""S. L. Song""}"
733752,empty,Eliciting relative preferences for two methods of colorectal cancer screening,European Journal of Cancer Care,English,1/5/01,0961-5423,14,124-31,2,"{""E. J. Frew"",""J. L. Wolstenholme"",""D. K. Whynes""}"
252118,empty,Bilingual speech: Bilateral control?,Brain and Language,empty,1/1/82,0093-934X,15,125-142,1,"{""H.M. Sussman"",""P. Franklin"",""T. Simon""}"
903817,empty,Tiao-She nursing of traditional Chinese medicine for mild cognitive disorder: An assessment of clinical evidence,Chin. J. Evid.-Based Med.,empty,empty,1672-2531,15,346-352,3,"{""Li X.-H."",""Li G.-C."",""Xie Y.-L."",""Shang H.-C."",""Chi K.-L."",""Jin Y.-H.""}"
80799,Angew. Chem. Int. Ed. Engl.,One-pot semisynthesis of exon 1 of the Huntingtin protein: new tools for elucidating the role of posttranslational modifications in the pathogenesis of Huntington's disease.,Angewandte Chemie (International ed. in English),eng,10/14/02,1521-3773,53,1928-33,7,"{""Annalisa Ansaloni"",""Jae Sun Jeong"",""Francesco Simone Ruggeri"",""Giovanni Dietler"",""Zhe-Ming Wang"",""Hilal A Lashuel""}"
385163,Cardiol Young,Pathophysiology of paradoxical embolism: evaluation of the role of interatrial septum anatomy based on the intracardiac echocardiography assessment of patients with right-to-left shunting.,Cardiology in the young,eng,1/15/01,1467-1107,25,47-55,1,"{""Gianluca Rigatelli"",""Paolo Cardaioli"",""Massimo Giordan"",""Ashesh Buch"",""Laura Oliva"",""Dobrin Vassiliev"",""Aravinda Nanjiundappa"",""Fabio Dell'Avvocata"",""Ramesh Daggubati"",""Dario Adami""}"
645061,empty,Impact of physical abuse on adulthood depressive symptoms among women.,Issues Ment Health Nurs,eng,1/8/03,1096-4673,29,299-314,3,"{""Hanan Al-Modallal"",""Ann Peden"",""Debra Anderson""}"
164721,empty,[The microclimate of apartments and its hygienic norms],Das Mikorklima der Wohnungen und seine hygienische Normierung.,empty,1/1/67,0049-8610,13,756-60,10,"{""M. S. Goromossow""}"
730721,empty,Prediction Study of Complications After Severe Trauma,empty,empty,1/12/01,empty,0,empty,0,"{""NCT01713205 ""}"
439302,empty,"American Society of Clinical Oncology clinical practice guideline update on the use of pharmacologic interventions including tamoxifen, raloxifene, and aromatase inhibition for breast cancer risk reduction.",empty,empty,empty,empty,0,empty,0,{NULL}
410748,empty,Preliminary validity and reliability of a Thai Berlin questionnaire in stroke patients,empty,English,1/14/01,empty,7,348,0,"{""J. Saengsuwan"",""K. Sawanyawisuth"",""N. Ungtrakul"",""J. Saengsuwan""}"
133777,Acta Clin Belg,Spectrum and frequency of illness presenting to a pediatric emergency department.,Acta clinica Belgica,eng,1/6/07,1784-3286,61,161-5,4,"{""P Grard"",""J Montesanti"",""P Lepage"",""M M Massin""}"
775428,empty,Organization of ribosomes and nucleoids in escherichia coli cells during growth and in quiescence,Journal of Biological Chemistry,English,1/14/01,0021-9258,289,11342-11352,16,"{""K. Peisker"",""B. Singh"",""S. Sanyal"",""Q. Chai"",""X. Ge"",""N. Metzendorf"",""S. Dasgupta""}"
497593,empty,"Ventricular arrhythmias in the North American multidisciplinary study of ARVC: predictors, characteristics, and treatment",empty,eng,1/14/01,empty,64,119-125,0,"{""N. A. Mark Estes"",""Scott McNitt"",""Wojciech Zareba"",""Bronislava Polonsky"",""Douglas Laidlaw"",""Mark S. Link"",""Frank Marcus"",""Kathleen Gear""}"
899060,empty,Maxillofacial metastases: a retrospective review of one institution's 15-year experience,Journal of Oral & Maxillofacial Surgery,English,1/13/01,empty,71,178-88,1,"{""R. A. Ord"",""A. Salama"",""R. Movahed"",""S. A. McClure""}"
424254,Acta Endocrinol Suppl (Copenh),Precocious and delayed sexual development in children,Acta Endocrinologica. Supplementum,English,1/1/88,0300-9750,288,66-76,0,"{""B. T. Rudd""}"
161290,empty,Premature androgenic alopecia and insulin resistance. Male equivalent of polycystic ovary syndrome?,empty,eng,1/5/01,empty,39,127-31 ST  - Premature androgenic alopecia and insulin resistance. Male equivalent of polycystic ovary syndrome?-,0,"{""L. Starka"",""J. Vrbikova"",""M. DA  - Dec DP  - Nlm ET  - 2006/03/24 Hill"",""M. Duskova"",""I. Cermakova""}"
746312,empty,Pancytopenia : A rare presentation of legionella pneumonia,Crit. Care Med.,empty,empty,0090-3493,41,A326,12,"{""Cayetano K."",""Ghannam D."",""Rawat N.""}"
191138,empty,Mold contamination in a controlled hospital environment: a 3-year surveillance in southern Italy,empty,empty,1/14/01,empty,14,empty,0,"{""C. Coretti"",""C. Napoli"",""G. Lovero"",""M. T. Montagna"",""G. Caggiano"",""G. Scarafile"",""O. de Giglio""}"
743819,Obesity (Silver Spring),Effect of (D)-fagomine on excreted Enterobacteria and weight gain in rats fed a high-fat high-sucrose diet.,"Obesity (Silver Spring, Md.)",eng,1/14/04,1930-739X,22,976-9,4,"{""Eunice Molinar-Toribio"",""Benjam_n Pia"",""Livia G_mez"",""Jara Prez-Jimnez"",""Marta Casado"",""Sara Ramos-Romero"",""Pere Claps"",""Josep Llu_s Torres""}"
193292,empty,CSM2004 best platform,empty,empty,1/4/01,empty,4,10-10 ST  - CSM2004 best platform-,0,{NULL}
91852,JAMA Intern Med,"The importance, and important limitations, of ultrasound imaging for evaluating thyroid nodules.",JAMA internal medicine,eng,10/28/13,2168-6114,173,1796-7,19,"{""David Cooper"",""Erik K Alexander""}"
663526,J. Hypertens.,Blood 25-hydroxyvitamin D concentration and hypertension: a meta-analysis.,Journal of hypertension,eng,1/11/04,1473-5598,29,636-45,4,"{""Susanna C Larsson"",""Ann Burgaz"",""Alicja Wolk"",""Nicola Orsini""}"
382853,Thorax,CT features of pulmonary arterial hypertension and its major subtypes: a systematic CT evaluation of 292 patients from the ASPIRE Registry.,Thorax,eng,1/15/04,1468-3296,70,382-7,4,"{""R Condliffe"",""J Hurdman"",""J M Wild"",""D G Kiely"",""S Rajaram"",""A J Swift"",""C A Elliot"",""C Davies"",""C Hill"",""I Sabroe"",""C Johns""}"
1266,empty,Clinical effect observation of fule cream to cure dermatitis eczemal,International Medicine & Health Guidance News [Guo Ji Yi Yao Wei Sheng Dao Bao],empty,1/8/01,empty,14,65-68-,14,"{""X. H. LYWXWF Wu""}"
407082,J Am Geriatr Soc,A randomized controlled trial of the effects of vitamin D on muscle strength and mobility in older women with vitamin D insufficiency.,Journal of the American Geriatrics Society,eng,1/10/11,1532-5415,58,Aug-63,11,"{""Amanda Devine"",""Nicole Austin"",""Richard L Prince"",""Kun Zhu"",""David Bruce""}"
411673,empty,Sleep and sleep disorders in the hospital,empty,English,1/12/01,empty,141,1337-45,5,"{""S. B. Venkateshiah"",""N. A. Collop""}"
