id,jounral_abbreviation,article_title,journal_title,article_language,article_jcreated_at,journal_issn,article_jvolumn,article_pagination,article_jissue,author_list
235295,Proceedings of the Royal Society of Medicine,Late repair of injuries of the anal sphincter,Proc R Soc Med,eng,1/1/71,0035-9157 (Print) 0035-9157,64,1187-9,12,"{""A. G. Parks"",""J. F. McPartlin""}"
498345,J. Infect. Dis.,Ebola Virus GP Gene Polyadenylation Versus RNA Editing.,The Journal of infectious diseases,ENG,2/15/04,1537-6613,-1,empty,-1,"{""Valentina A Volchkova"",""Jaroslav Vorac"",""Philip Lawrence"",""Laurie Repiquet-Paire"",""Viktor E Volchkov""}"
789958,Indian J Ophthalmol,Duane retraction syndrome associated with oculocutaneous albinism: an ocular miswiring.,Indian journal of ophthalmology,eng,1/6/12,0301-4738,54,283-4,4,"{""Jitendra Jethani"",""Shashikant Shetty"",""Sucheta Parija"",""P Vijayalakshmi""}"
169865,empty,"[Noninvasive prenatal diagnosis of trisomy 21, 18 and 13 using cell-free fetal DNA]",empty,pol,1/13/01,empty,84,"714-9 ST  - [Noninvasive prenatal diagnosis of trisomy 21, 18 and 13 using cell-free fetal DNA]-",0,"{""G. Jakiel"",""K. Gorzelnik"",""J. G. Zimowski"",""T. CN  - PubMed DA  - Aug DP  - NLM ET  - 2013/11/07 Roszkowski"",""J. Bijok""}"
803653,Dermatol Clin,Diagnosis and Management of Cutaneous B-cell Lymphoma.,Dermatologic clinics,eng,1/15/10,1558-0520,33,835-40,4,"{""Lauren C Pinter-Brown""}"
98234,empty,"Pregabalin, celecoxib, and their combination for treatment of chronic low-back pain",empty,eng,1/9/01,empty,10,185-91,4,"{""C. L. Romano"",""G. Mineo"",""C. Bonora"",""D. Romano""}"
823730,British medical bulletin,Activation and blockade of beta adrenoceptors in common cardiac disorders,Br Med Bull,eng,1/1/73,0007-1420,29,163-7,2,"{""B N Prichard"",""J W Black""}"
729712,empty,Long-term effects of spontaneous breathing during ventilatory support in patients with acute lung injury,American journal of respiratory and critical care medicine,English; ABSTRACT LANGUAGE:English,1/1/07,empty,164,43-49,1,"{""St_ber F"",""Mutz N"",""Wrigge H"",""Putensen C"",""Zinserling J"",""Zech S"",""Von Spiegel T""}"
396821,empty,Awareness of deficits and on-road driving performance,Clinical Neuropsychologist,English,1/11/01,1385-4046,25,1158-78,7,"{""L. J. Rapport"",""J. A. Griffen"",""L. A. Bieliauskas"",""C. Burt"",""R. C. Bryer""}"
340222,empty,A comparative evaluation of two head and neck immobilization devices using electronic portal imaging,The British journal of radiology,empty,1/6/01,empty,79,158-61,938,"{""K. Fleming"",""K. Donato"",""K. Leszczynski""}"
184417,empty,Disparities in childhood asthma hospitalizations: A spatial analysis of contextual effects,Transportation Research Part D-Transport and Environment,empty,1/9/01,1361-9209,14,317-325,5,"{""J. L. Li"",""P. Newcomb""}"
729686,Int J Clin Exp Med,Local anaesthetic wound infiltration used for caesarean section pain relief: a     meta-analysis,International journal of clinical and experimental medicine,English,1/15/01,1940-5901,8,10213-10224,6,"{""Yang M"",""Li J"",""Li Y"",""Zhou M"",""Yang H"",""Shi X"",""Li X"",""Yuan H""}"
278396,Acta obstetricia et gynecologica Scandinavica,Smoking is accompanied by a suppressed cervical nitric oxide release in women with high-risk human papillomavirus infection,Acta Obstet Gynecol Scand,eng,1/13/01,0001-6349 (Print) 0001-6349,92,711-5,6,"{""T. S. Mikkola"",""S. Vuorento"",""O. Ylikorkala"",""M. Vaisanen-Tommiska"",""P. Rahkola-Soisalo""}"
965082,empty,Imaging of scar in patients with ventricular arrhythmias of right ventricular origin: Cardiac magnetic resonance versus electroanatomic mapping,Heart Rhythm,empty,1/11/01,1547-5271,8,S40,5,"{""C. Hamilton-Craig"",""S. Bartoletti"",""M. Casella"",""F. Perna"",""M. L. Narducci"",""P. Santangeli"",""F. Pintus"",""A. Natale"",""A. Dello Russo"",""G. Pelargonio"",""G. Bencardino"",""J. D. Burkhardt"",""F. Bellocci"",""L. Di Biase""}"
53321,empty,Monoaxial versus polyaxial locking systems: a biomechanical analysis of different locking systems for the fixation of proximal humeral fractures,empty,eng,1/11/01,empty,35,1245-50,8,"{""T. Topp"",""C. Kuhne"",""S. Ruchholtz"",""U. Lewan"",""A. Kruger"",""T. Muller"",""R. Zettl""}"
13601,empty,Latex allergy in atopic children.,British Journal of Dermatology. ,eng,5/1/99,0007-0963,140,919-21,5,"{""R S Lever"",""S A Holme""}"
668310,Clin Interv Aging,"A randomized controlled trial of Tai chi for balance, sleep quality and cognitive performance in elderly Vietnamese.",Clinical Interventions In Aging,eng,1/12/01,1178-1998,7,185-90,-1,"{""Andreas Kruse"",""Manh Hung Nguyen""}"
282987,empty,"Multisystemic Therapy for social, emotional, and behavioral problems in youth aged 10-17",Cochrane Database Syst Rev,eng,1/5/01,1469-493X,0,Cd004797,4,"{""J. H. Littell"",""M. Popa"",""B. Forsythe""}"
478292,empty,Haemodynamic ischaemia in paediatric moyamoya disease associated with renovascular hypertension.,Acta Neurochirurgica,eng,1/1/97,Jan-68,139,257-8,3,"{""Y Takagi"",""N Hashimoto"",""Y Goto""}"
43736,Med Sci Sports Exerc,Effect of pedaling technique on mechanical effectiveness and efficiency in cyclists.,Medicine and science in sports and exercise,eng,1/7/06,0195-9131,39,991-5,6,"{""James C Martin"",""Ian Mayhew"",""Lee M Romer"",""Thomas Korff""}"
82614,Cancer Prev Res (Phila),"Lycopene metabolite, apo-10'-lycopenoic acid, inhibits diethylnitrosamine-initiated, high fat diet-promoted hepatic inflammation and tumorigenesis in mice.","Cancer prevention research (Philadelphia, Pa.)",eng,1/13/12,1940-6215,6,1304-16,12,"{""Lynne M Ausman"",""Martin S Obin"",""Xiang-Dong Wang"",""Chun Liu"",""Blanche C Ip"",""Donald E Smith"",""Kang-Quan Hu""}"
163526,empty,A performance improvement process to tackle tachysystole,empty,English,1/11/01,empty,40,512-9 ST  - A performance improvement process to tackle tachysystole-,0,"{""V. E. CN  - medline DA  - Sep-Oct DB  - MEDLINE DO  - http://dx.doi.org/10.1111/j.1552-6909.2011.01275.x DP  - Ovid Technologies von Gruenigen"",""A. M. Burkett"",""J. Doyle"",""T. H. Kenny""}"
514411,Cardiovasc Intervent Radiol,Osteoid osteoma treated by percutaneous thermal ablation: when do we fail? A systematic review and guidelines for future reporting.,Cardiovascular and interventional radiology,eng,1/14/12,1432-086X,37,1530-9,6,"{""Luca Maria Sconfienza"",""Ezio Lanza"",""Gianpaolo Cornalba"",""Dario Poretti"",""Catherine Cyteval"",""Pierre Viala"",""Francesco Sardanelli"",""Yann Thouvenin""}"
569841,J. Clin. Oncol.,Effects of chemotherapy in AIDS-associated non-Hodgkin's lymphoma on Kaposi's sarcoma herpesvirus DNA in blood.,Journal of clinical oncology : official journal of the American Society of Clinical Oncology,eng,5/20/09,1527-7755,27,2496-502,15,"{""Ariela Noy"",""Lawrence D Kaplan"",""Yanxing Yu"",""Alexandra M Levine"",""Richard F Ambinder"",""Susan E Krown"",""Bruce J Dezube"",""Lan Lin"",""Jeannette Y Lee"",""Gary S Hayward""}"
6207,empty,Serum MMPs 7-9 and their inhibitors during glucocorticoid and anti-TNF-alpha therapy in pediatric inflammatory bowel disease,Scandinavian Journal of Gastroenterology,empty,1/12/01,empty,47,785-794,7,"{""Kaija Leena Kolho"",""Hanne Rintamaki"",""Taina Tervahartiala"",""Timo Sorsa"",""Laura Makitalo""}"
21910,Glob J Health Sci,Examining waiting placement in hospital: utilization and the lived experience.,Global journal of health science,eng,1/14/03,1916-9736,6,22-Dec,2,"{""Donna M Wilson"",""Jessica A Hewitt"",""Ralph Magnus"",""Jill Vihos"",""Karen Peterson"",""Nancy Barnes""}"
378490,J Clin Psychiatry,"A prospective observational study of obesity, body composition, and insulin resistance in 18 women with bipolar disorder and 17 matched control subjects.",The Journal of clinical psychiatry,eng,1/8/12,1555-2101,69,1892-900,12,"{""Isabella Soreca"",""Andrea Fagiolini"",""David J Kupfer"",""Bret H Goodpaster"",""Sara B Fleet-Michaliszyn"",""Amy D Otto"",""John M Jakicic""}"
971878,empty,Diminished A-cell secretion in the early phase of type I diabetes mellitus,Metabolism: Clinical and Experimental,English,1/1/86,empty,35,1074-1077,11,"{""S. Srikanta"",""O. P. Ganda"",""R. E. Gleason""}"
793918,PloS one,Strong stability and host specific bacterial community in faeces of ponies.,PLoS One,eng,1/13/01,1932-6203,8,e75079,9,"{""Tina M Blackmore"",""Kirsty Dougal"",""Hilary J Worgan"",""Eric Pinloche"",""Gemma Curtis"",""C Jamie Newbold"",""Neil R McEwan"",""Susan E Girdwood"",""Pat A Harris"",""Caroline McG Argo"",""Alex Dugdale""}"
819166,empty,"Responses to open peer commentaries on ""the subjective brain, identity, and neuroethics""",American Journal of Bioethics,English,1/9/01,15265161 (ISSN),9,W1-W4,9,"{""G.R. Gillett""}"
880881,Korean J Gastroenterol,[A case of giant Brunner's gland hyperplasia combined with adenomyomatous hyperplasia].,The Korean journal of gastroenterology = Taehan Sohwagi Hakhoe chi,kor,1/8/12,1598-9992,52,384-8,6,"{""Seung Woo Park"",""Jae Bock Chung"",""Sang Kyum Kim"",""Si Young Song"",""Joo Won Chung"",""Ho Keun Kim"",""Joo Hee Seo"",""Seungmin Bang""}"
629530,empty,Efficacy and safety of the low-molecular weight heparin enoxaparin compared with unfractionated heparin across the acute coronary syndrome spectrum: a meta-analysis.,Eur. Heart J.,eng,1/7/09,0195-668X,28,2077-86,17,"{""Carolyn H McCabe"",""Shaun G Goodman"",""Frans Van de Werf"",""David A Morrow"",""Elliott M Antman"",""Eugene Braunwald"",""Kenneth W Mahaffey"",""Marc Cohen"",""Ian B Menown"",""Sabina A Murphy"",""Charles Michael Gibson""}"
954388,empty,Optimal Starting Age for School Attendance: FY76 Issue Analysis,empty,English,1/1/74,empty,0,46,0,"{""Marilou Madden""}"
379737,empty,Bone density and body composition in young women with chronic fatigue syndrome.,Neuroprotective Agents,eng,5/1/00,0077-8923,904,625-7,-1,"{""F Gates"",""P Clifton-Bligh"",""G Fulcher"",""L Hoskin"",""R Hansen""}"
676042,J Stroke Cerebrovasc Dis,Prognostic value of morning blood pressure surge in clinical events: a meta-analysis of longitudinal studies.,Journal of stroke and cerebrovascular diseases : the official journal of National Stroke Association,eng,1/15/02,1532-8511,24,362-9,2,"{""Yan-Xin Zhao"",""Jun-Chao Xie"",""Xue-Yuan Liu"",""Han Yan""}"
353972,empty,"Child sexual abuse as a risk factor for sexual risk behaviours among socially disadvantaged adolescents in Ibadan, Nigeria.",Vulnerable Children and Youth Studies,empty,1/8/01,1745-0128 1745-0136,3,243-248,3,"{""B O Olley""}"
968125,Respiration,Successful treatment of lung cancer by multimodal endobronchial interventions,Respiration; international review of thoracic diseases,English,1/14/01,0025-7931,88,144-147,2,"{""T. Nakajima"",""I. Yoshino"",""K. Yasufuku"",""S. Yoshida"",""Y. Sakairi"",""K. Shibuya""}"
660168,Neurosurgery,Fat and neurosurgery: does obesity affect outcome after intracranial surgery?,Neurosurgery,eng,1/9/02,1524-4040,64,316-26; discussion 326-7,2,"{""R Loch Macdonald"",""Farbod Asgarzadie-Gadim"",""Yeon Gyoe Jang"",""Daniel J Curry"",""Rachel N Yanowitch"",""Kim E Schultheiss"",""Jocelyn Tolentino"",""J_rgen L_ders""}"
732534,Health Facil Manage,Out of harm's way: curbing violence in the ED,Health Facilities Management,English,1/1/95,0899-6210,8,"20-6, 28",10,"{""K. Sandrick""}"
473026,Eur J Emerg Med,The incidence of contrast-induced nephropathy in trauma patients.,European journal of emergency medicine : official journal of the European Society for Emergency Medicine,eng,1/8/06,1473-5695,15,134-9,3,"{""Rich Sinert"",""Shoma Desai"",""Antonia Hipp"",""Carmen Lopez""}"
372175,empty,Dosimetric analysis of proton pencil beam scanning radiation therapy versus dose painted intensity modulated radiation therapy for squamous cell carcinoma of the anal canal,Int. J. Radiat. Oncol. Biol. Phys.,empty,empty,0360-3016,90,S398,1,"{""Kooy H."",""Hong T.S."",""Symonifka J."",""Depauw N."",""Wo J.Y.""}"
110072,J. Cereb. Blood Flow Metab.,Brain BDNF levels elevation induced by physical training is reduced after unilateral common carotid artery occlusion in rats.,Journal of cerebral blood flow and metabolism : official journal of the International Society of Cerebral Blood Flow and Metabolism,eng,1/14/10,1559-7016,34,1681-7,10,"{""Jacques Van Hoecke"",""Hayat Banoujaafar"",""Christine Marie"",""Claude M Mossiat""}"
330553,empty,Multiresistance of clinically relevant gram-positive cocci,Intensivmedizin und Notfallmedizin,empty,1/1/97,0175-3851,34,655-663,7,"{""G. Peters"",""K. Becker"",""C. Von Eiff""}"
23215,J Am Board Fam Med,ColoRectal Cancer Predicted Risk Online (CRC-PRO) calculator using data from the Multi-Ethnic Cohort Study.,Journal of the American Board of Family Medicine : JABFM,eng,1/14/01,1557-2625,27,42-55,1,"{""Leila Jackson"",""Brian J Wells"",""Gregory S Cooper"",""Siran Koroukian"",""Michael W Kattan""}"
719532,empty,Methodology to estimate building energy consumption using EnergyPlus Benchmark Models,Energy and Buildings,empty,1/10/01,0378-7788,42,2331-2337,12,"{""R. Luck"",""P. Mago"",""N. Fumo""}"
86421,Cancer Res.,Evidence that serum levels of the soluble receptor for advanced glycation end products are inversely associated with pancreatic cancer risk: a prospective study.,Cancer research,eng,5/15/11,1538-7445,71,Sep-82,10,"{""Stephanie J Weinstein"",""Rachael Z Stolzenberg-Solomon"",""Philip R Taylor"",""Barry I Graubard"",""Jarmo Virtamo"",""Demetrius Albanes"",""Li Jiao""}"
433667,empty,"Norton, Waterlow and Braden scores: a review of the literature and a comparison between the scores and clinical judgement",empty,empty,empty,empty,0,empty,0,{NULL}
530323,empty,"Strategies for partner notification for sexually transmitted infections, including HIV.",Cochrane Database Syst. Rev.,eng,1/13/01,1469-493X,10,CD002843,-1,"{""Catherine Mathews"",""Moleen Zunza"",""Adel Ferreira"",""Nicola Low"",""Taryn Young""}"
102893,J Clin Psychiatry,A cohort study of the prevalence and impact of comorbid medical conditions in pediatric bipolar disorder.,The Journal of clinical psychiatry,eng,1/10/11,1555-2101,71,1518-25,11,"{""Roger S McIntyre"",""Avnish Tripathi"",""Jeanette M Jerrell""}"
864817,empty,Are tkis still active in patients treated with tki and everolimus? Experience from 36 patients treated in france in the record 1 trial,Annals of Oncology,empty,1/10/01,empty,21,viii284,0,"{""B. Escudier"",""A. Ravaud"",""F. Rolland"",""A. Blesius"",""B. Beuzelink"",""S. Oudard"",""C. Chevreau""}"
217725,empty,Use of alendronate in peri-implant defect regeneration,empty,English,1/1/99,empty,70,151-158,2,"{""P. C. Wollan"",""S. J. Meraw"",""C. M. Reeve""}"
730822,Ann R Coll Surg Engl,"Prevention of phantom pain after major lower limb amputation by epidural infusion of diamorphine, clonidine and bupivacaine",Annals of the Royal College of Surgeons of England,English; ABSTRACT LANGUAGE:English,1/1/94,0035-8843,76,324-326,5,"{""Jayatunga AP"",""Dark CH"",""Jahangiri M"",""Bradley JWP""}"
659297,Am J Phys Med Rehabil,How assistive technology use by individuals with disabilities impacts their caregivers: a systematic review of the research evidence.,American Journal Of Physical Medicine & Rehabilitation / Association Of Academic Physiatrists,eng,1/12/11,1537-7385,91,984-98,11,"{""James Lenker"",""W Ben Mortenson"",""Frank DeRuyter"",""Louise Demers"",""Jeffrey W Jutai"",""Marcus J Fuhrer""}"
42247,J Sci Med Sport,"Gender differences in personal, social and environmental influences on active travel to and from school for Australian adolescents.",Journal of science and medicine in sport / Sports Medicine Australia,eng,1/10/11,1878-1861,13,597-601,6,"{""John W Toumbourou"",""Eva Leslie"",""Peter Kremer"",""Joanne W Williams""}"
302969,empty,Adolescent overscheduling: The relationship between levels of participation in scheduled activities and self-reported clinical symptomology,empty,empty,1/7/01,empty,90,18-30,3,"{""Steven G Little"",""K Angeleque Akin-Little"",""Shari Melman""}"
158672,Comput Chem Eng,Quantitative Analysis of Robustness of Dynamic Response and Signal Transfer in Insulin mediated PI3K/AKT Pathway.,Computers & chemical engineering,ENG,4/14/12,0098-1354,71,715-727,-1,"{""Shibin Mathew"",""Ipsita Banerjee""}"
616298,J Clin Anesth,Does neuraxial anesthesia reduce intraoperative blood loss? A meta-analysis.,Journal of clinical anesthesia,eng,1/6/09,0952-8180,18,427-35,6,"{""David N Maine"",""Genevieve E Courpas"",""James F Weller"",""Jeffrey M Richman"",""Andrew J Rowlingson"",""Christopher L Wu""}"
221086,empty,Novel genetic linkage of rat Sp6 mutation to Amelogenesis imperfecta,empty,eng,1/12/01,empty,7,34,0,"{""K. Miyoshi"",""T. Noma"",""T. Muto"",""H. Hagita"",""T. Horiguchi""}"
548616,empty,"Educating Emergent Bilinguals: Policies, Programs, and Practices for English Language Learners. Language & Literacy Series",Teachers College Press,empty,1/10/10,0-8077-4913-3,0,empty,0,"{""Ofelia Garcia"",""Jo Anne Kleifgen""}"
669596,Knee Surg Sports Traumatol Arthrosc,Similar survival between uncemented and cemented fixation prostheses in total knee arthroplasty: a meta-analysis and systematic comparative analysis using registers.,"Knee surgery, sports traumatology, arthroscopy : official journal of the ESSKA",eng,1/14/12,1433-7347,22,Jul-91,12,"{""Junwei Jiang"",""Hongchuan Wang"",""Hua Lou"",""Kai Liu"",""Huiwei Zhang""}"
474288,J Geriatr Oncol,Current palliative chemotherapy trials in the elderly neglect patient-centred outcome measures.,Journal of geriatric oncology,eng,1/15/01,1879-4076,6,15-22,1,"{""Marlies L van Bekkum"",""Barbara C van Munster"",""Marije E Hamaker"",""Carolien H Smorenburg"",""Peter L M Thunnissen""}"
108424,Obes Surg,Outcome of gastric bypass patients.,Obesity surgery,eng,1/2/04,0960-8923,12,261-4,2,"{""Ryan Holzwarth"",""Basir Tareen"",""Alicia Majkrzak"",""Darren Huber""}"
841679,empty,A Modified Technique for Pulmonary Valve Replacement with a Homograft,J. Card. Surg.,English,1/11/01,-7977,26,144-147,2,"{""S. K. Choudhary"",""G. S. Gulati"",""P. Sharma"",""S. Talwar"",""B. Airan"",""S. Mishra""}"
173830,empty,"Advances in allergic skin disease, anaphylaxis, and hypersensitivity reactions to foods, drugs, and insects",Journal of Allergy and Clinical Immunology,empty,1/5/01,0091-6749 (Print),116,153-163,1,"{""S. H. Sicherer"",""D. Y. M. Leung""}"
852927,empty,"Phase II study of epirubicin, oxaliplatin and docetaxel combination in metastatic gastric or gastroesophageal junction adenocarcinoma.",J. Exp. Clin. Cancer Res.,eng,1/9/01,1756-9966,28,34,-1,"{""Laura Giacinti"",""Silvia Ileana Fattoruso"",""Maria Grazia Arena"",""Luigi Di Lauro"",""Massimo Lopez"",""Domenico Sergi"",""Diana Giannarelli""}"
237623,Clin Evid (Online),Neck pain.,Clinical evidence,eng,1/8/01,1752-8526,2008,empty,1,"{""Allan I Binder""}"
912884,empty,A guide to physiotherapy in cerebral palsy,Paediatrics and Child Health,empty,1/8/01,empty,18,410-413,0,"{""C. E. Barber""}"
318931,empty,Community associated methicillin-resistant Staphylococcus aureus in HIV-infected patients,AIDS Reviews,empty,1/10/01,1139-6121,12,153-163,3,"{""M. Pujol"",""P. Barragn"",""J.M. Tiraboschi"",""A. Imaz"",""M.. Dom_nguez"",""D. Podzamczer""}"
93659,Sheng Wu Yi Xue Gong Cheng Xue Za Zhi,[The anxiety level of the patients who will have ultrasound-guided puncture biopsy: a survey study].,Sheng wu yi xue gong cheng xue za zhi = Journal of biomedical engineering = Shengwu yixue gongchengxue zazhi,chi,1/12/06,1001-5515,29,"453-5, 459",3,"{""Rujun Zheng"",""Yulan Peng"",""Shuzhen Zhao"",""Hong Huang"",""Ii Liang"",""Xiaoli He""}"
349150,Ophthalmic Surg Lasers,The relationship between capsulorhexis size and anterior chamber depth relation.,Ophthalmic surgery and lasers,eng,3/1/99,1082-3069,30,185-90,3,"{""O Ceki_"",""C Batman""}"
572010,empty,"A pilot study of rituximab in patients with recurrent, classic Hodgkin disease.",CANCER,eng,7/15/03,0008-543X,98,310-4,2,"{""Anas Younes"",""L Jeffrey Medeiros"",""Frederick Hagemeister"",""Maria Alma Rodriguez"",""Sima Jeha"",""Paolo Fiumara"",""Lynne V Abruzzo"",""John T Manning"",""Jorge Romaguera"",""Andre Goy"",""Dan Jones"",""Peter McLaughlin""}"
826030,Eur J Cardiovasc Nurs,A cognitive behavior intervention program in women with unexplained chest pain--a pilot study,European journal of cardiovascular nursing : journal of the Working Group on Cardiovascular Nursing of the European Society of Cardiology,eng,1/12/01,1474-5151,11,183-9,2,"{""Cecilia Bj_rkelund"",""Margaretha Jerlock""}"
34962,J. Neurol. Sci.,Assessing social isolation in motor neurone disease: a Rasch analysis of the MND Social Withdrawal Scale.,Journal of the neurological sciences,eng,11/15/13,1878-5883,334,112-8,1,"{""Everard W Thornton"",""Carolyn A Young"",""Alan Tennant"",""John Ealing"",""Kevin Talbot"",""[Collective Name] UKMND-QoL Group"",""Chris J Gibbons"",""Pamela J Shaw""}"
574309,Transplantation,"Three-year Outcomes in de Novo Liver Transplant Patients     Receiving Everolimus with Reduced Tacrolimus: Follow-Up Results from     a Randomized, Multicenter Study",Transplantation,English,1/15/01,0041-1337,99,1455-1462,7,"{""Junge G"",""Rauer B"",""De Simone P"",""Fischer L"",""De Carlis L"",""Kaiser GM"",""Saliba F"",""Duvoux C"",""Metselaar HJ"",""Dong G"",""Nevens F"",""Fung JJ""}"
200077,empty,Plasma cell leukemia--a case report.,Indian Journal of Pathology and Microbiology,eng,1/3/07,0377-4929,46,484-7,3,"{""T K Dutta"",""Pampa Ch Toi"",""Bhawana A Badhe"",""L H Ghotekar"",""Debdatta Basu""}"
421512,empty,CABG again outshines stenting for some patients with coronary artery blockage,empty,eng,1/13/01,empty,309,17-Aug,1,"{""M. Mitka""}"
715052,empty,Health-promoting behaviors of low-income cancer survivors,empty,empty,1/11/01,empty,25,118-124 7p,3,"{""Alexa Stuifbergen"",""Martha Gene Meraviglia""}"
172966,empty,Food allergy in children,Archives De Pediatrie,empty,1/6/01,0929-693X,13,1349-1353,10,"{""E. Bidat""}"
140274,Nepal Med Coll J,"Here to stay. An interview with Dr. David Satcher, Director, U.S. Centers for Disease Control and Prevention.",Nepal Medical College journal : NMCJ,eng,11/1/96,empty,1,9-Jun,17,"{""J Stilkind""}"
282039,empty,The first case of drug-induced immune hemolytic anemia due to hydrocortisone,Transfusion,empty,1/8/01,0041-1132,48,1925-1929,9,"{""M. Martinengo"",""D. F. Ardenghi"",""G. Reali"",""G. Tripodi""}"
835177,European journal of cancer care,KRAS mutational status assessment in patients with metastatic colorectal cancer: are the clinical implications so clear?,Eur J Cancer Care (Engl),eng,1/10/01,0961-5423 (Print) 0961-5423,19,167-71,2,"{""M. Hebbar"",""P. Fournier"",""O. Romano""}"
519732,Stat Methods Med Res,Classifying radiographic progression status in early rheumatoid arthritis patients using propensity scores to adjust for baseline differences.,Statistical methods in medical research,eng,1/7/02,0962-2802,16,13-29,1,"{""John T Sharp"",""Weng Kee Wong"",""Grace S Park"",""Harold E Paulus"",""MyungShin Oh"",""Richard H Gold"",""Dinesh Khanna""}"
761104,empty,"Infusing Tolerance, Diversity, and Social Personal Curriculum into Inclusive Social Studies Classes Using Family Portraits and Contextual Teaching and Learning",TEACHING Exceptional Children Plus,empty,1/5/01,"1553-9318, 1553-9318",1,empty,3,"{""Milagros M. Sessions"",""Kevin J. Miller""}"
408062,Actas Urol Esp,Adherence to fesoterodine in women with overactive bladder in routine clinical practice.,Actas urologicas espanolas,engspa,1/15/05,1699-7980,39,222-8,4,"{""E Huguet"",""O Porta"",""E Mart_nez"",""I Mora"",""M Sim_"",""J Pubill"",""J A Ortega"",""M T Castillo""}"
889481,"Einstein (Sao Paulo, Brazil)",Chronic pain related to quality of sleep,Einstein (Sao Paulo),eng     por,1/14/01,1679-4508,12,159-63,2,"{""W. Hummig"",""J. Stechman Neto"",""L. F. Tonial""}"
894596,empty,On the role of pre and post-processing in environmental data mining,"Proc. iEMSs 4th Biennial Meeting - Int. Congress on Environmental Modelling and Software: Integrating Sciences and Information Technology for Environmental Assessment and Decision Making, iEMSs 2008",empty,1/8/01,9790000000000,3,1937-1958,0,"{""Miquel S_nchez-Marr"",""Geoff Holmes"",""Joaqu_n Izquierdo"",""Joaquim Comas"",""Ioannis Athanasiadis"",""Karina Gibert""}"
604985,Journal of medical toxicology : official journal of the American College of Medical Toxicology,Cardioactive steroid poisoning: a comparison of plant- and animal-derived compounds.,J Med Toxicol,eng,1/6/12,1556-9039,2,152-5,4,"{""Robert S Hoffman"",""Brian W Cotter"",""Barbara M Kirrane"",""Fermin Barrueto"",""Lewis S Nelson""}"
220950,empty,Forensic odontology: A prosthodontic view,empty,eng,1/12/01,empty,4,38-41,1,"{""S. Gosavi"",""S. Gosavi""}"
770196,International journal of gynaecology and obstetrics: the official organ of the International Federation of Gynaecology and Obstetrics,FIGO staging of gynecologic cancer. 1994-1997 FIGO Committee on Gynecologic Oncology. International Federation of Gynecology and Obstetrics,Int J Gynaecol Obstet,eng,1/1/99,0020-7292,64,10-May,1,"{""W. T. Creasman"",""S. Pecorelli"",""J. L. Benedet"",""J. H. Shepherd""}"
914468,Rev.Neurol.,Effect of neuromuscular electrical stimulation and isotonic exercises in flexor and extensor muscles of knee of hemiplegic patients,Revista de Neurologia,empty,1/8/01,0210-0010,46,135-138,3,"{""S. Regina-Ribeiro"",""C. Tortoza"",""R. P. S. Lima"",""S. T. T. de Freitas"",""P. R. Lucareli"",""M. O. Lima"",""M. T. Pacheco"",""J. Gomes-Lucareli"",""R. A. Lopes-Martins""}"
346326,"Journal of cardiovascular medicine (Hagerstown, Md.)",Ventricular fibrillation in acute mitral valve insufficiency caused by chordae tendineae rupture: report of a surgically corrected case.,J Cardiovasc Med (Hagerstown),eng,1/9/03,1558-2027,10,261-3,3,"{""Giovanni Teodori"",""Marta Leverone"",""Eraldo Occhetta"",""Miriam Bortnik"",""Paolo Marino"",""Marco Marcolongo""}"
